{"schema_version":1,"sequence":1,"published_at":"2026-07-30T00:00:00Z","source_commit":"0123456789012345678901234567890123456789","min_client_version":"0.3.0-beta.1","candidates":[{"name":"maven","display_name":"Apache Maven","description":"Build automation","homepage":"https://maven.apache.org/","default_vendor":"apache","vendors":[{"name":"apache","display_name":"Apache","releases":[{"version":"3.9.11","selector":"3.9.11","support_tier":"core","artifacts":[{"artifact_id":"maven-3.9.11-linux-x64","archive_type":"tar.gz","platforms":[{"os":"linux","arch":"x64"}],"url":"https://example.com/maven-3.9.11.tar.gz"}]}]}]}]}
